<!ELEMENT menu (category*) >

<!ELEMENT category (application*, category*) >
<!ATTLIST category name CDATA #REQUIRED >

<!ELEMENT application (name, uri?, description?, logo?, screenshot?, display?) >
<!ATTLIST application id ID #REQUIRED >

<!ELEMENT name ( #PCDATA ) >
<!ELEMENT uri ( #PCDATA ) >
<!ELEMENT description ( #PCDATA ) >
<!ELEMENT logo ( #PCDATA ) >
<!ELEMENT screenshot ( #PCDATA ) >
<!ELEMENT display ( #PCDATA ) >
