<?xml version="1.0" encoding="utf-8" standalone="no"?>
<!DOCTYPE menu SYSTEM "apps-list.dtd">

<menu>
	<category name="Example">
	<application id="test1">
		<name>Application Test 1</name>
		<uri>http://test1.__DNSDOMAIN__/</uri>
		<description>A simple application displaying authenticated user</description>
		<logo>wheels.png</logo>
		<display>auto</display>
	</application>
	<application id="test2">
		<name>Application Test 2</name>
		<uri>http://test2.__DNSDOMAIN__/</uri>
		<description>The same simple application displaying authenticated user</description>
		<logo>wheels.png</logo>
		<display>auto</display>
	</application>
	</category>

	<category name="Administration">
	<application id="manager">
		<name>WebSSO Manager</name>
		<uri>http://manager.__DNSDOMAIN__/</uri>
		<description>Configure LemonLDAP::NG WebSSO</description>
		<logo>tools.png</logo>
		<display>on</display>
	</application>
        <application id="sessions">
                <name>Sessions explorer</name>
                <uri>http://manager.__DNSDOMAIN__/sessions.pl</uri>
                <description>Explore WebSSO sessions</description>
                <logo>tools.png</logo>
                <display>on</display>
        </application>
	</category>

	<category name="Documentation">
	<application id="localdoc">
		<name>Local documentation</name>
		<uri>http://manager.__DNSDOMAIN__/docs/</uri>
		<description>Documentation supplied with LemonLDAP::NG</description>
		<logo>docs.png</logo>
		<display>on</display>
	</application>
	<application id="officialwebsite">
		<name>Offical Website</name>
		<uri>http://wiki.lemonldap.objectweb.org/xwiki/bin/view/NG/Presentation</uri>
		<description>Official LemonLDAP::NG Website</description>
		<logo>web.png</logo>
		<display>on</display>
	</application>
	</category>
</menu>
